1,USER_MENTION new u.s border patrol chief raul ortiz says in the next few days the us will hit million encounters with migrants for
2,USER_MENTION my statement on sfrcs passage of the ethiopia peace and stabilization act of our crucial bipartisan legislation to
3,USER_MENTION the pm and others said for weeks that rules were we know today for an absolute fact that these were lies
4,USER_MENTION gernot rohr qualified us for the world cup with game to spare some said this oyinbo coach dey do wey our local
5,USER_MENTION we are giving away whitelist spots to win one of those simple follow us USER_MENTION like
6,USER_MENTION price drops media craps all over us well guess what stillnotselling URL
7,USER_MENTION if england win tonight against ivory coast well giveaway a URL mystery box how to
8,you always stick up for when im wrong n you know want to thank you for for putting up URL
9,USER_MENTION USER_MENTION i can say what the hell i want to its ok to be sceptical of this reparations thing URL
10,listening to my daughter on the phone telling my mam the best nana ever for buying her a play house and URL
